{
  "name": "shell-foundation-preview",
  "version": "2.0.1",
  "capability": "shell.adapter.operator",
  "trust": "community",
  "entry": "examples/shell-foundation-preview",
  "capabilities": [
    "shell.adapter.operator",
    "theme.bridge.shell"
  ],
  "compatibility": {
    "core": "v2.0.1",
    "shell": "v2.0.1",
    "wizard": "v2.0.1"
  },
  "certification": {
    "status": "placeholder",
    "lane": "develop"
  },
  "source": {
    "type": "github",
    "location": "github.com/udos/examples-shell-foundation-preview"
  }
}
